{
  "$schema": "https://json-schema.org/draft/2020-12/schema",
  "$id": "https://github.com/swhume/odmlib_examples/gendefine/mapping_schema.json",
  "title": "gendefine Mapping Configuration",
  "description": "Schema for JSON mapping configurations that map metadata spreadsheet formats to Define-XML v2.1 concepts.",
  "type": "object",
  "required": [
    "mapping_version",
    "mapping_name",
    "description",
    "define_version",
    "global_settings",
    "worksheets"
  ],
  "properties": {
    "mapping_version": {
      "type": "string",
      "description": "Version of this mapping configuration format."
    },
    "mapping_name": {
      "type": "string",
      "description": "Human-readable identifier for this mapping."
    },
    "description": {
      "type": "string",
      "description": "Description of the spreadsheet format this mapping supports."
    },
    "define_version": {
      "type": "string",
      "description": "Target Define-XML version (e.g., '2.1')."
    },
    "global_settings": {
      "$ref": "#/$defs/global_settings"
    },
    "worksheets": {
      "type": "object",
      "description": "Mapping definitions keyed by worksheet name.",
      "additionalProperties": {
        "$ref": "#/$defs/worksheet_entry"
      },
      "minProperties": 1
    },
    "oid_patterns": {
      "type": "object",
      "description": "OID generation patterns keyed by Define-XML element type.",
      "additionalProperties": {
        "type": "string"
      }
    },
    "value_transforms": {
      "type": "object",
      "description": "Value transform definitions keyed by transform name.",
      "additionalProperties": {
        "$ref": "#/$defs/value_transform"
      }
    },
    "defaults": {
      "type": "object",
      "description": "Default values for Define-XML attributes keyed by attribute name.",
      "additionalProperties": {
        "type": "string"
      }
    }
  },
  "additionalProperties": false,
  "$defs": {
    "global_settings": {
      "type": "object",
      "description": "Global settings that apply across all worksheets.",
      "properties": {
        "language": {
          "type": "string",
          "description": "Default xml:lang value for TranslatedText elements."
        },
        "default_purpose": {
          "type": "string",
          "description": "Default Purpose value for ItemGroupDef when not in spreadsheet."
        },
        "annotated_crf_leaf_id": {
          "type": "string",
          "description": "Leaf ID for the annotated CRF document reference."
        },
        "oid_generation_strategy": {
          "type": "string",
          "enum": ["pattern", "column"],
          "description": "Default OID strategy: 'pattern' generates from templates, 'column' reads from spreadsheet."
        }
      },
      "additionalProperties": true
    },
    "worksheet_entry": {
      "type": "object",
      "description": "Mapping definition for a single worksheet.",
      "required": ["target", "format", "column_map"],
      "properties": {
        "target": {
          "description": "Define-XML element(s) this worksheet produces.",
          "oneOf": [
            { "type": "string" },
            {
              "type": "array",
              "items": { "type": "string" },
              "minItems": 1
            }
          ]
        },
        "format": {
          "type": "string",
          "enum": ["attribute_value", "tabular"],
          "description": "Worksheet layout: 'attribute_value' for key-value pairs, 'tabular' for header + data rows."
        },
        "column_map": {
          "type": "object",
          "description": "Column-to-attribute mappings keyed by spreadsheet column name.",
          "additionalProperties": {
            "$ref": "#/$defs/column_map_entry"
          }
        },
        "oid_pattern": {
          "type": "string",
          "description": "OID generation pattern for this worksheet's target element (e.g., 'IG.{Dataset}')."
        },
        "oid_source": {
          "type": "string",
          "description": "Column name that provides OIDs when strategy is 'column'."
        }
      },
      "additionalProperties": false
    },
    "column_map_entry": {
      "type": "object",
      "description": "Mapping definition for a single spreadsheet column.",
      "properties": {
        "maps_to": {
          "type": "string",
          "description": "Target Define-XML attribute path (e.g., 'Description.TranslatedText', 'ItemRef.OrderNumber')."
        },
        "also": {
          "description": "Additional attributes to populate with the same value.",
          "oneOf": [
            { "type": "string" },
            {
              "type": "array",
              "items": { "type": "string" }
            }
          ]
        },
        "oid_role": {
          "type": "string",
          "enum": ["component", "parent_lookup"],
          "description": "Role in OID generation: 'component' contributes to OID, 'parent_lookup' references parent element."
        },
        "oid_source": {
          "type": "string",
          "enum": ["column"],
          "description": "Indicates this column provides explicit OID values."
        },
        "oid_prefix": {
          "type": "string",
          "description": "Prefix for OIDs generated from this column's values."
        },
        "optional": {
          "type": "boolean",
          "description": "Whether this column can contain empty/null values."
        },
        "type": {
          "type": "string",
          "enum": ["integer", "float", "string"],
          "description": "Type coercion target for this column's values."
        },
        "processing": {
          "type": "string",
          "description": "Name of a value_transform to apply to this column's values."
        },
        "ignore_for_define": {
          "type": "boolean",
          "description": "If true, this column is read but excluded from Define-XML generation."
        },
        "resolve": {
          "type": "string",
          "description": "Cross-reference resolution strategy name."
        }
      },
      "anyOf": [
        { "required": ["maps_to"] },
        {
          "properties": { "ignore_for_define": { "const": true } },
          "required": ["ignore_for_define"]
        }
      ],
      "additionalProperties": false
    },
    "value_transform": {
      "type": "object",
      "description": "A value transformation rule.",
      "required": ["type"],
      "properties": {
        "type": {
          "type": "string",
          "enum": ["lookup", "type_coercion", "regex_parse", "custom"],
          "description": "Transform type."
        },
        "map": {
          "type": "object",
          "description": "Lookup table mapping input values to output values (for 'lookup' type).",
          "additionalProperties": { "type": "string" }
        },
        "default": {
          "type": "string",
          "description": "Default value when lookup has no match (for 'lookup' type)."
        },
        "target": {
          "type": "string",
          "enum": ["integer", "float", "string"],
          "description": "Target type (for 'type_coercion' type)."
        },
        "pattern": {
          "type": "string",
          "description": "Regex pattern (for 'regex_parse' type)."
        },
        "output_fields": {
          "type": "array",
          "items": { "type": "string" },
          "description": "Output field names for regex capture groups (for 'regex_parse' type)."
        },
        "handler": {
          "type": "string",
          "description": "Handler function name (for 'custom' type)."
        }
      },
      "additionalProperties": false
    }
  }
}
